	content	label
7505	I hate em..	1
6020	lol just rhyming  gay i know	1
4023	makes you feel cheap doesn't it.  I hate that clients use these things...	1
5952	YES. the thing is big enough for my ass plus another half. its like my parents couch.	1
1586	Wendy's - Oriental Chicken Salad w/ grilled chicken.  Way good.  I think it's 20 grams of fat just in the dressing  tho! Argh.	1
7063	Mind your own state politics. Joe Smith was a mammal before a prophet. Some mammals are gay and even heterosexuals have anal sex.	1
8600	that sucks. At least you've got GB xD	0
18559	&quot;hey angel  you duh sexy&quot;	0
12637	Holy Fuck Man  I've been thinking about you. That's fucked up.	0
11829	HAPPY BIRTHDAY DAN PANOSIAN THE SUPER QUEEN OF LOVE/HATE/POWER/SAVY/HOLLYWOOD AND CAKE	0
7492	NERD!	1
10548	yeah. time zones are a bitch.	0
1355	I iz calm now - cept I can't figure out how to properly edit my wordpress templates. NERD ALERT NERD ALERT.	1
5586	The FA50 is a low key ultra here in ATL. It stands for Fat Ass 50K. Loop course  so you could do 25K...Half Ass.	1
15077	who do you like?	0
15245	Haha I know huh(: lol jealous bitches	0
2535	i want you dead.	1
5673	Fuck you  McGaffigan. I WANT TO GO. NAO!	1
9792	Dude  I was DYING. The way he ducked was freaking hysterical. Even though it wasn't cool at all  it was damn funny.	0
10753	Err:508	0
6187	cuz montana sucks?	1
2999	that sucks that you're sick. Sorry to hear that.	1
1976	LMAO. I was very confused. What a bitch she is.	1
11450	I'm going to fucking Florida on Friday. FUCK THAT SHIT	0
1856	"says ""ahaha thankss. my auntie kim always says it grassy ass=] she's amazing."""	1
2616	Your 44 years old? :O! Dumbass  Pedifile. :D	1
5761	"Girl  talked to Black Milk on the phn for an hour. Watching ""Big Bang Theory"" drunk as fuck  eating cereal & its cold in the D."	1
9026	Are you trying to freak me out?	0
17337	If you could go only to one restaurant for the next five years  which would it be?	0
734	church can also suck my dick.	1
6915	might install now that you've acted as my guinea pig :D	1
5322	no grown man should include DIP in his sentence....lol...I know I'm hatin but fuck it I'm lookin @ snow..lol	1
18583	ight well its kinda hard...idk well mi lil boo  mi boo  and mi ex.	0
19220	yep	0
3444	You know damn well your boss is going to leave early.  When the mouse is away . . .	1
8455	omg omg omg yes yes that's it...that's perfect! You are fucking awesome!	0
1762	did he really???!!!! OH FUCK OK I TAKE BACK ON DAN MARINO IM SORRY!!!! OK I BLAME ROMO AGAIN! AND WHITTEN! i'm through with them!	1
9171	You are with your parents????? You poor baby! I love and hate vacationing with mine.	0
1223	u in a good mood souljaboy why u in a good mood oh n i luv ur new song 'damn ' like it hit   me bac	1
493	I feel like such a nerd watching this! I LOVE IT!!!!!!!!!	1
17688	USA.	0
4456	I hate math really do!but will be happy as well when I finish university!	1
5030	A gay couple getting married in NYC isn't going to change anyone's idea about marriage. Divorce has redefined marriage.	1
2277	if anyone's a loser  it's YOU.	1
10350	What's happening brotha? I'm good. Been a busy day getting ready for my big fat free bootcamp manana! How about you?	0
10018	Matt this game sucks  we need some Sharks mojo!!!	0
2934	"You've got 5"" of snow?  Damn.  I'm jealous."	1
5662	The guy who runs it is a major dick  underpays or doesn't pay models. He's harassed me and belittled me.	1
1014	I really hate bailing these guys out! They treat everyone like crap!	1
19023	possibly	0
6325	"i really hate that song but thats like equivalent to ""fuck them other niggas"" to the 40 and up crowd"	1
17938	Have you ever tried to kill yourself by holding your breath?	0
4463	aw man  that sucks!	1
14552	jordin!!!!!!!!!!!!!!!!!!!!!!!!!!!!!!!!!! rudeo did you say the other mean things to?	0
14965	nahhh	0
3479	Because they are FUCKING DUMB and annoying	1
2676	Nope. I actually have a life. *COUGHCOUGH* unlike you  the lonely pathetic ugly lowlife man/woman who&;s life events are: staying on formspring creating fakes and starting shit. Seriously  I&;m not the bitch  you are. END OF STORY. KCOOLBYE.	1
18209	Wow some dude wants you rach :/	0
3696	yo Zee  you keep your hair tighter than frog ass.	1
7676	aww that sucks :/	1
12701	@seanhackbarth It is a hate-fest  and that's the way I like it.	0
19191	If you get cheated by the Better Business Bureau  who do you complain to?	0
19120	Is Tosha your real name?	0
10490	Man up pussy. NO SMOKES FOR U!!	0
7688	Kick ass!	1
6870	Fuck off.. I'm not ready!	1
14458	Thank you <3	0
19667	ew no.	0
1926	Yes! All of those twitters were directed at Frank Miller and his horrible screen play! DAMN YOU FRANK MILLER ILL KEEL YOU!	1
10209	you will do fine. good luck. go kick some ass!	0
13072	Already did. Dude it'smissing every thirdorso spacebarkeystroke.Actually  it missed most in this fucking tweet. I am so pissed.	0
19458	i may	0
4854	i hate you.... you know why	1
10975	"There is def. imprint of my ass on floor under my own bed... ""Someday my prince(ss) will come""..sing it. YOU are my princess!"	0
5997	I meant boo YOU whore!	1
14911	I have fallopian tubes.	0
8858	and we spent hours together (with her husband) picking out their favorites... so I use them... and then they say they hate that photo	0
19396	What&;s the nicest thing someone&;s ever done for you?	0
5777	Oldest son just turned 19 months and youngest is 5 weeks old. Damn dude  u look too young to have a 17 year old! :)	1
5008	FIRE HIM!!!!!!  lol lame ass mofo....	1
16904	fly most definantly.	0
3504	PETA is an ass in the article  D. Big time.	1
12213	hate.being.cold.	0
19601	haha thanks (:	0
19738	are you loyal?	0
18349	Not currently	0
8643	ha ha fucking ha	0
4322	I want beach now. Damn.	1
1365	1) i can't stop laughing at how's the meows sound like cat o-face screams. 2) ugh  so bummed i missed out. another gay? (:	1
8598	ROFL!!!  The trick with my cake is  it doesn't taste fat free...but it is.  What more can a girl want? ;-D	0
8064	Little kids. I love em. School aged kids...NO THANK YOU! Especially not these grown ass kids nowadays! *smack* LoL.	0
7295	yes yes  so gay.	1
4752	http://twitpic.com/qtt0 - O.O bingo is waaaaay to hard for me. hate it. i wanna fuck it..wait thats didnt come out right	1
2699	lmao.. &quot;yurr reall funny skinny ass bitchh&quot;.. hm.. that isn&;t really much of an insult now is it? what if i was fat? lol u suck at talkn shit :] later white trash skank :] ur super ugly nd that guy u like really isnt gonna come back around for u. laterrrr	1
1352	you dont need a big fat spirit animal to be embarassed...	1
18755	I LOVE Sudoku's :] Read  Paint  I think I would be just fine recovering :)	0
5408	Ha! Yeah  that caught my attention  too. Now wait & watch for Red Wings fans to freak. I'm gonna make popcorn for that show :)	1
6822	fucking buses. One drove straight past me on Friday night  and I was waving my arms like a windmill. Baaaaah!	1
10609	Awesome. Wouldn't have been near as funny w/o his contagious laughter or all the ass authorities making comments...	0
17479	lol yea you are	0
6086	grab that... It's yours  bitch!	1
15988	um um um um um um um bank it and then go shopping with a keycard thingo coz then if i got robbed it wouldnt matter as much hahahahahaha	0
223	Yeah  I mean I know the plan and the creative are kick-ass. But sometimes clients have a warped view.	1
1047	fuck you dom	1
3427	there only a few shows i really look forward to seeing.  i hate when they put a reality show on instead with no warning.	1
8863	LOL! I give @johnhenrymuller all the props in the world he is holding down a family and working his ass off though so he wins.	0
7256	Fucking pallys. I learned to hate them playing Warcraft III. And fuck rogues too while we're at it.	1
906	I almost punched her vagina into the new year... grrr she was a cunt bag. How is your trip going?	1
6369	sadly true - mens lifestyle walks a fine line between britneys bits  and articles about pectoral development for gay guys...	1
8149	I hate that salt is on my new car	0
7437	...fuck jared leto. i forgot it was his bday. 25th HIS BIRTH 26th MY BIRTH ECHELON THROUGH THE BACK DOOOOR.	1
12247	Ew. That sucks :( Can you take it back?	0
4523	gay man	1
1595	so fucking angry all the time	1
17776	If you could lose one emotion  which would you like to lose?	0
4778	"Read your post  ""Sincerity Sucks.""  Thank you! I feel less guilty for holding certain ""sincere"" people accountable for actions"	1
14629	if you had the opportunity to be in a movie with any actor/actress who would it be?	0
18894	It was a while ago but i said f on the phone when i was really upset and talking to my dad. i never cuss in front of my parents. so it was an ooopsie i guess haha	0
12159	Sorry about  ur bank trouble  but all that talk about ur Curvy Ass has me way to distracted to get anything done today.	0
11776	don't worry my English sucks too! Thanks!	0
10288	Well then get some damn sleep ya dumbass! Lol	0
9154	dude that fucking sucks. He was a cool cat. RIP	0
18123	Do you watch bugs crawl on the floor?:	0
5525	LOL - nah  that's just what we tell the loser guests that we usually toss down in the newsroom!! oh  wait...	1
15790	do you smoke or drink	0
2394	dude.  she's fugly.  i think ur a desperate ass cam perv.	1
16340	I would love to follow him :]r Absolutely!!!!!	0
18381	What can you not be trusted with?	0
15325	no thanks	0
14868	What would be harder for you  to tell someone you love them or that you do not love them back?	0
1851	grrr I hate that. I have an ex-friend who only gets in touch when they have something great to tell me about themselves... o_0	1
4609	Yep  it's blocking the absurd hate ur preparing to throw my way in 5....4...3.....2......1	1
3469	damn  why don't all harem leads shout that  kouhai~? would be interesting the resulting chaos	1
10379	"I didn't think about drinking every time she said ""maverick."" Damn. Could have done it every time she talked about energy  too."	0
4502	The 401 always sucks between Cobourg and Kingston. I'll be doing that joyous trek on Boxing Day to visit the relatives.	1
5557	I thinks you meant to say that TWILIGHT was epic fail  not your mistake. I hate stephanie meyer and I've never even met her.	1
8356	doesn't matter. Lost. Loser. Not the winner. Didn't cut it.	0
18696	kkkkk thanks for all your spam in a can.	0
1153	LOL well it's funny as hell they got two fat asses trying to fit threw some small holes.	1
13701	wheres my laptop slut!	0
4251	OOGA BOOGA FOOCHA FUCK YOUR WHOLE DAY!!!!!!!!	1
690	HAHA...emo lawn.  I dig that!	1
15916	Apriiiiiiiiiiiill!!! I miss uuuu! It&;s Emma btw haha	0
3592	"did you come up with the ""server-hugger"" moniker  or what some other wise-ass?"	1
4628	just found the email buried in inbox - count me **IN** i've been on the receiving end of foodbanks growing up. it SUCKS BIGTIME	1
1951	fuck no _ I'll be out there by myself.  That's my ALONE time. Meditate if you will. Me the pipe & the stars rflecting & thnkng	1
9074	my brother does that all the fucking time. Its ridiculous	0
3497	lol yeah  I coulda told you that cuz I'm a big fucking dorkass about that movie as wel all very well know :) I actually had a dream	1
19813	Why do you press harder on the remote-control when you know the battery is dead?	0
13755	Hate to tell you... there is an arctic storm coming through California. You might want to pack the Chicago wardrobe WHAA???!!!	0
11838	YOU TELL THAT BITCH SNOWSTORM NOTHING AIN'T GONNA GET YOU DOWN!	0
4468	damn you have really become an ordinary man... man that sucks ass!!! lol :P	1
14259	Why do they put crutons in an air tight sealed bag? They are just pieces of stale bread to begin with  right?	0
2665	dude you are such a fucken fagget ahahaha	1
13785	Ooo.. Did your grumpy-face avatar just get a little grumpier? Sucks - I do NOT want to be driving this weekend. Will Rudy be ready?	0
8940	Their Steam games don't have SecuSuck. Add one more reason to the list why Steam just kicks ass.	0
921	like I said  I wouldn't even do it with your dick!	1
7273	N HOW BOT BARBARA GOT ANGIE ASS GUH ME N TELA WAS LAUGHN 2 DAM HARD	1
848	"that  and ""I'm not gay"" aw I miss bonez.  I hope he's not in prison."	1
1429	@Kimber_Regator You guys are in the same fucking house and using twitter to talk.	1
12380	thank yoooou. I'm probably going to get my ass handed to me lmao	0
9736	hahaha okay. yeah twitter hates my ass. not getting ANYONES updates. Fuckers. LOVE YOU BIRTHDAY GIRL!	0
4779	Maybe they're looking for Carl!!!  That damn Carl.	1
10783	Win an NBA championship w/ what team? The Knicks? Damn right! ;P	0
828	"i'm glad someone is teaching that 3-year-old how to ""slap dat ass"" :)"	1
1427	that really sucks :-( I could have recommended you an amazing chiropractor!	1
482	Dang I hate the little buttons. GO BACK ONE TWEET!	1
209	aw  thanks. it's going better than yesterday  that's for damn sure. :-D	1
1544	How does he feel about marmite? Love It or Hate It?	1
1955	i hate you! i want to be in bed :(	1
815	Damn cat. She snuck into Aidan's CRIB (1st time) he woke screaming - went in - he was squeezing her & she was kicking his tummy.	1
9297	translation for the white boy: naty  nobodys last  name is The Ass. Haha	0
8318	19 tabs in 1 window (hate windows  love tabs)	0
10476	For the record  it's fucking freezing...	0
1741	weekend ofzo? 3) I still hate twitter 4) I love Gerard he's writing umbrella academy but I still haven't read it yet -shame on me	1
6486	I especially hate it when they make me lift up my feet to sweep under my desk. Sigh.	1
5553	sure you can  I'll hide the flashlight. go emo go!	1
5812	damn those Jets!  Hears hoping for happier fucks in the future. *blinks*	1
18465	yeah	0
6269	Online nakedness amuses me.  'Oh my god  he has nipples!  And skin!  He's a freak!'.	1
820	"the lox ""f**k you "" ""keep it thoro"" prodigy  ""we run this"" fat joe  ""i come thru"" styles and nore  ""broken language"" smooth"	1
3031	Pretty much  but now there will be less AIM errors! Weeeee  you can see that I don't type like a retard!	1
3237	It's just crazy. This boy is fucking up my sleep schedule. Probably why I don't mind too much. ;)	1
16592	do you like nevershoutnever	0
4616	Damn Jim idk what to say:/ Sorry man.	1
1325	Charisma Carpenter is a CUNT.  I also told her.	1
19282	Yes if there were another way other than relying souly on mankind.	0
13751	Every time I'm on the computer downstairs.  I hate that thing. I feel like there are retarded monkeys inside pulling switches.	0
14974	Does it bother you that travesti immitate your favorite singers?	0
5660	my programs is telling me the same damn thing. WTH!?!	1
14507	where is Old Zealand?	0
17397	Hell yahh(; LOl I love you too babeyyygirl<3 no matterr what	0
1775	Josh needs medication. Stat. Can i kick his ass for you now?	1
4127	I have news 4 you this whole month is going 2 suck ass  I hope u like banquets n ramen cause thats whats on the menu this month :(	1
4605	y'all are so fucking classy. miss you!	1
11620	Damn right I do.  :)	0
19228	them disagreeing with me	0
7248	"HAHAHA. tom cruise ""I WILL FUCK YOU UP"""	1
5274	Unibroue 17 !!!! Another damn good Unibroue	1
972	I promise it'll go away as soon as @CalamityJen wakes up and kicks my ass.	1
18238	no	0
19807	funny background statement =>	0
4123	Way to go loser  how does it feel to be an inanimate objects bitch? Must feel terrible to NEED something to be normal. Shame on you!	1
19735	hahahaha true lady goo goo	0
9761	Sucks. No cognac in the house.	0
867	in time for when I travel and the train company still refused to let me travel. The fucking wankers.	1
5972	sometimes I hate how contagious US culture is	1
1744	That sucks. Are you alright?	1
18070	Sunshine. Lots of food and hanging with my boyfriend and family :]r Awesomeness.	0
2275	AND DAMN I JUST LOST /AGAIN/.	1
4111	"Thanks! I'm not familiar w/ the ""nerd heard"" language. You should add #NH  so I can say #WUW #NH @craigsanaotmy!"	1
2673	YOU&;RE RETARDED NEVER MIND.	1
15335	bahaha idk :) whats goin on?	0
14170	iDnt even kno who da hell they are	0
3613	:(( @ tweet tweet you cookie crumble ass nigga	1
2904	stop the hateration bitch! it's only gonna make that mohawk stand up rotf!!!	1
978	"My sis made me think @ your ""Femmes & Fags"" blog..she is a total boi but so extra that you would think she was a fag. lol"	1
2380	ass get out its ur last day damn it!	1
9064	I am sorry to hear about your foot. That really sucks. I hope you feel better.	0
3912	he is a HUGE POSER! I want Toyboy back!	1
10647	Damn  I miss The Mark Show sometimes. :-)	0
3583	@Dave_Malby acting as Colfax Chick's agent! After 100 followers I will make sure to get her ass down here and tweet with everyone	1
16413	yes. not sure really. Maybe the earth and all the planets are just tiny specs of dirt in a giants pocket somewhere..	0
9890	Oh yes I did... I can't stand to see OSU blow it ever year.  I hate the BCS and it just goes to show what happens.	0
803	Frickin turnovers! Dang flags.  SD's gonna beat our ass and Denver is going to blow a 3 game lead. They don't deserve to win.	1
1003	art IS easy. who the fuck gives A+s?	1
17071	omg really i never noticed lol =]	0
15422	What&apos;s the best thing you&apos;ve ever eaten?	0
17147	What happens when you put a lightsaber in water?	0
6917	that sucks *hugs* :(	1
18146	Isnt that quote from alice in wonderland?	0
1958	oh  i am fine. But she will not be if she doesn't shut her fat fucking mouth.	1
5840	guy walks in to a bar with a duck on his head. The bartender says can I help you. The duck says yeah  get this guy off my ass.	1
8774	shit  probably!!  Bitch was always looking for a hand out.  I think that plus the paranoia.	0
16889	not too often unless im in the car	0
6247	I hate to point this out  but didn't you call Death Race awesome? DR will make my bottom 10 list w/o a doubt.	1
1059	the fuck shit is this? people died for less. lol	1
2063	Fucking pallys. I learned to hate them playing Warcraft III. And fuck rogues too while we're at it.	1
8128	don't diet! I'm not trying until Jan then its hardcore dieting for me! And sucks about your boiler breaking :'(	0
6534	fashion parade. (damn sneaky mousepad enter key thing.)	1
4838	Damn dude...	1
5438	oh hot damn!	1
18141	Doo You Still Gedd Ass Wopinqq&;s (: hahaha ;; Ps Dont Lie ?	0
2145	That really sucks. :(	1
18331	haha no then u will be lik o ew that guy ~_~  *runs away* lol	0
5750	http://is.gd/brVS (iTunes) or http://is.gd/b4yp Antrel Rolle previewed today's MIN game on the Best Damn Sports Show Podcast.	1
18582	my mommy(:	0
14328	I am going to go to bed now. I still ahve alot of stuff on my mind. Ehhh... well have a good/day. <3 Leave me things.	0
15229	Naah (;	0
17702	A L W A Y S : ]	0
16675	how often do you check on your formspring?	0
16654	Kindness to all  or your exiled to the shark sea.	0
1493	I spent all last week with that damn song in my head. :)	1
13005	yo me and you both watched that  and no lie I was scared straight my damn self!	0
18246	what&;re you wearing right now?	0
636	We miss you back. My Haiku: Famous Dickenson  Exactly Why - I'm not sure. Her poetry sucks.	1
2089	WOW YOUR A BAD ASS... HAHA	1
15361	i hate when people are mad at for no reason at all...what about you?	0
9598	thank god i live alone and that it hasn't happened. ever had lemonade through the nose? fucking HURTS	0
7255	- damn you and your constant banoffee pie mentions!! Very tempting LOL	1
266	the iced media party. Long ass day at the office  time for a drink or 3	1
12912	I'd rather ban divorce than gay marriage. No question.	0
354	when can I meet your uncle??? Maybe he could give a wiki demo to our loser peeps!?	1
5011	Fat ass!	1
5959	dont hate ur life! =_=	1
408	i'm with you on the new yrs res! i'm 10lbs chubbier than i was 8 mos ago and i ALSO thought i was completely immune to fat! :(	1
9427	It is; I hate winter.	0
6563	Damn dog  didnt call them like I said to? Well I is working till around 9ish	1
19564	what does teaachgee mean? do you know what emahsnouoy mean? :]	0
3888	I'M THE JUGGERNAUT  BITCH!	1
567	LOL I did zackly same thing! BTW thanks for leading me to @ChipEFT Just reqd Born Loser's Guide to Abundance! http://rurl.org/18kr	1
16245	cute	0
379	i just fucking beat you!	1
15613	Suree :)	0
9325	re: the hate crime in NYC: it was a combination of racial and anti-gay slurs.  Why was the gay part left out of the story?	0
15807	What are your thoughts on earwax?	0
404	did Santa cum n visit u huny?	1
4318	oh damn! anyways next time...DM me ur number or soemthing	1
10239	For serious? No fooling? Fuck yeah!	0
12382	That I can understand. And because I really can see both sides  it just sucks.	0
15234	have you been to any ocean park?	0
4739	This bad gay works for a company that likes to write people up for sneezing.	1
4072	that sucks;{	1
2267	http://twitpic.com/vhtp - LOOOOOOL HATE!!!!!!	1
1795	Hot damn  champ right here! Had the old school TT shell helmet on for the whole trip. Backwards even! Huoooooooah!	1
1204	I've been getting a lot of that Which sucks  cause I really need a job.I did get a random check from an old job for 100$ today though	1
9348	oh I hate that feeling!	0
373	LOL Hon  I have been saying for a while now that this boy will be gay. It really bothers the hubs when I do  so Im tryin 2b good	1
3700	"yo freak ""sarath freak"""	1
3219	The guy who runs it is a major dick  underpays or doesn't pay models. He's harassed me and belittled me.	1
2421	@ryanruppe damn you...	1
3577	lol just rhyming  gay i know	1
13226	"- Ha ha  true ""Half a product is better than a half-ass product""  but I dont want http://www.vamooz.com/ to be both!!!"	0
2965	Ha! Yeah  that caught my attention  too. Now wait & watch for Red Wings fans to freak. I'm gonna make popcorn for that show :)	1
15085	Would you consider yourself to be spoiled?	0
15708	Everything!!! seriously.r But when im sad. Ah me by griffen house  I love ADTR &amp; Emarosa any time of the day  anything I can do the robot to and Emmure when Im feeling thrashin :] ha. Ohh and i like instrumental music. Underoaths cd of violins is my all time favorite <3	0
2561	Leave Texas bitch!! No one here wants you!! Quit hating on Texas and Brock  we were perfectly fine without you BITCH! ... sooo LEAVE!	1
19613	no	0
14586	lmao rite chea boo hehe	0
4136	hmm didnt even know they existed...no wonder i feel like a complete retard when i cut stuff with a scissor	1
14406	I like too many songs to have a favorite	0
5431	"Are you laughing your ass off with all these ""juicy"" twits?"	1
15284	Cats or Dogs?	0
9371	this is just awful  i'm really tired and will be dragging ass all day.	0
7679	That sucks dude!	1
2531	Is it ok if I&apos;ve jizzed to pics of you before?	1
6265	"Because ""Oh  for fuck's sake!"" has so much more impact. And our generation likes to offend old people as deeply as possible."	1
3097	i don't know that bambi's ass is a nice place. LOL	1
3532	That depends on if you are dealing with a pain slut or not.	1
19426	Not currently. Im on a waiting list and I really enjoyed microbiology :)	0
19584	What age would you liek to get married?	0
16264	Why do you think people get irrate over little things?	0
4964	You're still alive? Well  damn  I just lost a bet.	1
18222	Are you a lonely boy?	0
12073	Hate Wall-E? Your girlfriend has no soul. EAT HER.	0
13314	Sucks  doesn't it?	0
18202	when was the last gift you received?	0
18490	do you go to church regularly?	0
241	haha! No. We have a new stand up board at work and we have barstools to sit on. I hate them!	1
5083	fuck up foo.	1
8969	can you let it drag you like a retard?	0
5696	ground her now and she'll kick your ass lol	1
15183	:)))))))))))))))))))))	0
13060	Love to travel  but hate to unpack. ;)	0
7223	Fat Baby drinkinggg and listening to Duffy's band	1
6518	Charisma Carpenter is a CUNT.  I also told her.	1
19509	Have you ever been to South America or Africa?	0
10456	Lucky me  no snow in Hazel Park at least not yet. 2 inches expected . Daily fat burning walk to the end of my driveway  again.	0
12951	I'm really sorry I can't help with your cravings. FIND SOME PEOPLE TO CLICK ON THE DAMN PORTAL. Seriously raid warnings work.	0
13761	Ugh we used to hate him. I remember when he said he didn't like me	0
15256	(: Tabitha Jai Locascio (:	0
17980	i love you to :D	0
8588	"That would be called ""Fuzzy Math"" and ""Fat Pockets""."	0
5726	Dang I hate the little buttons. GO BACK ONE TWEET!	1
14344	Is it dina?	0
4681	Oh  that sucks. Why I blew off my own appointment yesterday. I just couldn't face the wait.	1
15782	its okay i honestly still dont understand why you got so angry  but sometimes you get mad worse then girls do. just saying  not trying to sound mean. but you do.	0
5804	what are you gonna stab a bitch with? scissors? knife? spear? sword? cock? pencil? dildo? cattle prod? broken glass?	1
9915	Um... I hate birds. Bleech!	0
7334	I hate them. So much.	1
12796	...math/science (esp. physics) were my fav subjects in school... the longer the book the better... think I'm an nerd yet? ;)	0
3575	because the sandman is being a punk ass ho...	1
3113	Listen  RayRay  I gave you the lowdown as soon as I got it. I hadn't heard it b4 and I was shocked. She seems to hate his guts.	1
3742	"heh and then u yell ""HOLY SHIT IM FAT"""	1
5265	truth on both counts that guy is an ass  and their product is sub par. I tell people try Dalesandros orJim's	1
1271	you smell like the insides of a beluga whale's forehead	1
12378	@donwill this is true. i've been obsessed with ramen for months  thanks to Yvette and that damn restaurant in manhattan.	0
4731	regarding you and your tea obsession  you have become SO GAY  break out the Thermite man!!!!!  Shape up	1
8562	my UFC wannabe cousins and I do the same thing!	0
3697	if you don't know who i am  why follow me? get a fucking life and stop bitching about the past	1
13606	"Obviously helping disabled children is more worthwhile than what we do! (But to say we sell ""gifts for people you hate""?)"	0
