	content	label
1566	Warm Mt Dew tastes awful. :/ Try Jolt Cola instead. Or maybe even Whoop Ass. http://tinyurl.com/8woa3j	1
9491	"Really? wow! Avril  she sucks. LOL! I bet that was the best NIN concert this year since it being the ""last""."	0
3074	Boo  to be fair they shouldn't give away your room. Kick their ass!	1
8559	Dude  that sucks. I hope it's not really a big leak.	0
18366	like his movies. dont like him.	0
11395	I remember and that's why I loves that ass. U make me feel special. Lol	0
8336	Damn  that sounds good!  lol.  Now I don't remember what I wanted to eat tonight.	0
11141	Damn! If only I lived down there! Looking to capture some weddings here...not too many when it's snowing!	0
7854	and also jus my lappy is gone so m usin last fm...othrwise who gives a damn...once its bak i'll hav all the songs so bbye last.fm	0
3674	lock it  yank his rights on both his accounts.  He's been a little bitch lately and I'm sick of it.	1
189	OMG bundesliga and brasilian bossanova. This was worse than seeing your loved family dog licking his ass. I'm scarred	1
12937	sure  but having a kick ass de facto admin plugin sure would rock!  for some folks... *shrug*	0
12170	Soon  i must brush my teeth. It's about that time. I think during the next Madonna song. Hmm  but which one? Damn! I'm confused	0
16814	fuck no! i live with a used-to-be sheriff  im careful with the law outside of my home :D	0
12178	do you keep getting the one with the wheel that stick? I hate that:)	0
6715	or maybe go see bolt tonight? or both? don't know if you're busy for white whale stuff... but it's my bday. let's celebrate	1
7083	Reid I made it!  urghhh... I hate shopping. The trauma of it sent me hiding under the covers. Or maybe that was the cold.	1
9522	damn herb you yelp A LOT. i looked up your yelp profile hehe.	0
6789	It's got a core of uranium  some damn thing  I don't know. Gets up there like Sputnik.	1
11993	Sounds almost as good.  Original Halo was great.  Next Fri night with no wife we should nerd it out with Wii  Xbox & Movies!	0
11850	@shayscene --I'm sayin'! I mean  I'm a Winnie Cooper guy  but Topanga was a good ass woman. Plus...the rack! Yowza!	0
6724	ps...ur cute...ur good looking  your funny  your a dick  your an ass  your cynical. I LOVE IT!	1
4705	i hate you! i want to be in bed :(	1
8108	damn girl..how sad is that..shame on that wack-ster!!	0
11675	"It was such a great time for real music  great fashion & hair. Do u remember the word ""Poser?"""	0
17299	noooooooooooooo you dont have a name	0
14277	Once.	0
8180	maybe later when they're all glistening in dairy fat.	0
1214	I remember when being snippy just meant I was trying to piss someone off... am I showing my age? :)	1
1875	Yeah! This blond gay guy came to audition. I almost fell out of my chair when I saw him. He looked identical to chris corner!	1
6849	"sweet. I'm too chicken to read it cuz I hate ""spoilers""';)"	1
18713	What&;s your dream car?	0
13971	damn... U should just stay home and call it a nite!	0
15163	what do u guys prefer? Jonas brothers or justin bieber	0
9173	Damn. That's pretty bad. Ewww...	0
1732	Have you heard any J-Fish songs. if you want a sneek peak I can send you a few songs =) I have all his CD's I'm a J-Fish freak lol	1
7558	lawl @ fat bitchez.	1
18650	do iKno iKan go check out mi musik n listen to it bxtch lmao... myspace.com/pokemonboyz7	0
7547	FOR REAL!!!! I NEED TO JUST STOP!!!! REALLY!!!! FUCK!!!!!	1
18587	Why you confused?	0
10832	Asian Philosophy??? DAmn you must know how to Game the ^-^ perfectly now	0
17054	Committed  I want to like one girl cause then I will know for sure that she is the one((: <3	0
12281	Down here  people are smart enough to not piss on an electric fence  let alone do it again after being shocked once.	0
11734	Oooh!  I hate it when that happens.  DH to the rescue!	0
6548	I iz calm now - cept I can't figure out how to properly edit my wordpress templates. NERD ALERT NERD ALERT.	1
4788	Have you seen his ugly ass? he IS the phantom. Women wouldnt sleep with him if he didn't woo us with melodies and faux-mance	1
5013	i couldnt agree more. HATE sandra lee!	1
1161	fuck that!	1
19285	Pink Roses!(:	0
18970	Do you cry often or keep it inside?	0
6921	Damn that's a lot of money for tickets! I guess her little girl only turns 16 once though. :-)	1
5284	Thats pretty damn awesome! Very smart :) @Aaronage Sure!	1
1863	Hey  don't knock the Port+OJ until you've tried it.As cold remedies go  you're still sick but no longer give a damn. ;)	1
6194	Why does CHUD hate kids so much? 10 years from now  they're your readers!	1
7889	smart ass - here http://thetyser.com/	0
14464	anyone or someone particular?	0
7397	ur smater than me then. last year  i was out on nye sick as fuck. came home with pneumonia	1
4338	Courtesy of the Canadian kids magazine Chirp: How does a sick pig get to the hospital?	1
4163	I hate you sometimes. lol	1
18264	No. Only because if it were up to fate then noone truly has any choices in life. And well i don't like to be told what to do. I like making my own mind up! :]	0
18167	alejandro by lady gaga	0
17254	do you love justin?	0
7242	You kidding  I bloody hate anime  and I liked Bleach.	1
6593	yeah fuck it kill um all!	1
16901	Do you like to dance?	0
6141	NOONONOONONNNOONONNONONONOONON cock mongler..... you didn't eve nstraighten it...	1
14863	about sheep	0
344	"says ""no more pizzas for the situation room! or else we will be fat when the war is over..."""	1
1751	all that I know of is the Revenge vinyl. u? and sorry for delayed answer  my internet sucks and trips out	1
6200	whatever you do just don't roll your eyes. they hate that. those peaceful scenes fly out their heads and they WILL b-slap you!	1
19433	Who&;s the most talented person you know?	0
5727	ironic - I normally hate plastic 4 environmental reasons- this time  it actually saved some of the patterns from the wet grass	1
3787	goddamn it kj...fuck you 10 times http://tinyurl.com/5nv2tl	1
1381	Hey  don't hate on NC.  They got bought out by PNC and alot of people are losing their jobs.  Cleveland has a sad face...	1
8173	You ARE NOT! Who called you that?!? Me and @BethHarte have experience with tag-team whup-ass! C'mon Beth... let's roll. LOL	0
11448	on a crack pipe  that's about it. fuck him. he was wack from day 1  don't let the radio fool u	0
4955	FUCK YEA! THX! Id like to thank all my influences from my grandma (rip) to Sam L.  id also like to thank myself for being great!	1
8090	Girl! That. Damn. Commercial. !!!	0
10418	& @VIChick: I feel as tho I spend every weekday waiting 4 the weekend. Then I spend the weekend dreading the damn work week.	0
3282	"- you can trust me to do my part to help @adam_callender win his ""biggest loser"" contest.  ;)"	1
845	Big Ass was this past weekend and went well  #2 (Last Minute Maul) is this weekend.	1
4248	Funny that the guy's last name is Dick...bwaha! :-D	1
19471	If the whole world were listening  what would you say?	0
12219	I miss your ass too! :0)	0
17053	Umm like; sure(x	0
14981	no	0
9981	God damn the Mets hahah :(	0
19022	Yes. :)	0
17289	What famous person do other people tell you that you most resemble?	0
11511	Why do you hate America?	0
6648	Oh it's pretty much public knowledge that I hate shaving my legs. Or at least it is now.	1
665	dang...i need to stop eatting cheese. Damn you kraft!	1
502	could be that I'm not typing hard enough? happened a lot more when I first got this laptop about 3 weeks ago. Sucks ass	1
4087	try fuck.	1
4818	I should round house kick ur al qaeda lookin ass in the face with my flip flops!	1
10165	I hate having a bunch of pics in my camera roll	0
2678	...If you want to go back to Idaho so bad why dont you??? ... Texas doesnt want you here anymore than you want to be soo .. just leave!!!	1
7324	You'd be television slut.	1
18637	uhm (:	0
13851	damn son. I just saw the cool and dee joint to. Still rocking the mixtape tho. Keep that fire coming...	0
18871	when my little brother was diagnosed with cancer and we all thought we were going to lose him :( it was a dark moment.	0
9185	haha. a little off. but i picked up my 28 year old's sister copy that we got her for christmas and tried to hate it.	0
4574	Wait if I shut down my phone company who's going  to sponsor you in the emo olympics?	1
6114	like I said  I wouldn't even do it with your dick!	1
293	Its foggy as hell here too. Looks like damn Seattle.	1
635	i forgot 2 call in gay 2day too! blast!	1
6874	I love New HAmpshire well the white Mounts.I'm from Maine and I know I hate cold also hence why I moved to Fla.	1
7465	hate u	1
18930	(:	0
13850	i hope you dont mean port charlotte. :P this town sucks.	0
18588	know whats going on because then it was MY CHOICE to be hurt.	0
11641	i hate the fact that you are addicted to twitter. but anyways  lets pop imaginary prozac pills together and enjoy the holidays.	0
3066	no i think you will hate it. Its a bunch of dirty work.	1
2913	i loved it  i laughed my ass off	1
18820	What did you do for your last birthday?	0
1231	It could be pig's lips from a garbage bag! Perk up  buttercup!	1
18700	Do you volunteer for anything?	0
4662	dude.. I just think the twinke or whateva you call it... It damn cool.. LOL	1
8505	DOH! That sucks man  I hope the rest of your trip goes smoothly!	0
13528	hahaha internet is damn slow today	0
1186	What!? Oh  that sucks!	1
9619	Those things Freak. Me. Out.	0
18401	you! :]	0
14579	go back to sleep! hahaha	0
4093	I HATE that. I have a rhomboid  almost triangular 'washcloth' from learning bark sedge stitch. I use it to scrub the bathroom.	1
5942	yea..brang yo ass down  son :) I'll be @ Essence again...Staying @ the W! (thanxxxxxx Sony woop woop n da poop poop)	1
15579	yum yum	0
1288	"oh! I saw the ex earlier. Asked if I ""fancied a fuck"" before he left the hospital. I politely declined."	1
8561	damn this Xmas party. I want to be home playing it also.	0
4387	@DaveBenjamin I HATE THAT...	1
2036	With the departure of the Sonics  I've adopted them as my squad. I still fuck w/ CP3 and the Hornets  but I gotta go Pacific NW.	1
997	fine! i'll stop!! Quit stompin' my cock!	1
7379	sigh.. I can telw you because altho you'll laugh at me at least you won't think I'm a freak or tell anyone.	1
14360	not really	0
18657	haha good me eitherrrrrr.	0
1376	well clean the damn floor!	1
12208	Thanks. :) Yes  way cold N the house. The Bf is not a fan o heat  so we don't use it. I  otoh  HATE the cold.  Passionately.	0
19675	Is there anyone who was in your life that it hurts you to think about?	0
8914	aw dude!! That sucks.. Well whever u put a new tell me:) nice job with the vids	0
6076	Or  he's just sick of hearing me bitch about the cold and doesn't know what else to get me. I like your theory better  lol.	1
13119	LOL  forgot about him...didn't Lois torch his ass in an episode of Family Guy?	0
4787	Damn straight.	1
17963	no.	0
2644	your ugly.	1
18004	Yess it was pretty cute ;)	0
1277	yeah. subconscious sucks sometimes. always telling me what I'm doing is wrong. Most of the time it's not. :)	1
7251	@folub i'm hammered and want you both at Hot Damn.	1
19233	looooooove them!	0
16311	yes. many people. i work with alot of the mentally handicapped	0
1005	lick on these nuts and suck the dick.	1
6627	thanks sugar  i get a little sensitive here and there. damn holidaze!	1
15248	Because they feel they have noone else that will love them. but truly i dont understand why people do that?? its very confusing to me. There's only about a biazillion people in this world that you can meet and fall in love with...why end it for one individual. theres so much more out there!	0
9034	What's with the iPhone hate?	0
16637	no.	0
3962	ahh damn it: Action 12.1.5.0 of Microsoft.SharePoint.Upgrade.SPSearchDatabaseSequence failed. and i didn't snap shot my VM DOH!	1
8059	Yeah  I guess so... God  I hate them. You like the show  too?? Yay!	0
13767	Well fuck. You can say that again!	0
14262	Were you ever physically abused?:	0
14079	Hmmm i dont have one right off hand?	0
15718	buncha kind things have been done for me. BUNCH!	0
17684	Not at all	0
17678	Can you go underwater without holding your nose?	0
17986	:)	0
2047	i mean damn don can you get back to ya own brother?!?!?	1
10475	#NAME?	0
19823	Have you bought any new clothing items this week?	0
6681	Hahaha  Testosterone Man!!!  I met Mega Bitch Soccer Mom the other day. She took the time to stop  honk her horn  & flip me off	1
17954	qualtily :) of course.	0
2789	yeah go ahead and play victim  i do know you nico. thats how i know your a player.	1
10899	I don't know  but I hate mass DMing.	0
18409	Would you rather get up early or sleep late?	0
1830	I hate trying to hear over loud music lol	1
2870	hehehe. mine pleasure. Btw I too so loves it  when people be presumptous pricksy wicksies! feel jolly nice for me ass to rub on.	1
12460	TELL IT TO STOP BEING SUCH A DICK!	0
19084	OHIO in the states. hahahaha	0
8434	When the kids in those commercials scream at their parents...I get so upset.  Saying shut up and I hate you....terrible.	0
16844	are you a trusting person?	0
5300	Epic WINS for Fuck City&lt;3	1
3808	i've yet to be impressed with anything from his mouth. He was pissed I wouldn't drive from coweta to pick his drunk ass up	1
2486	That sucks dude!	1
2458	Rooster is LARRY'S bitch!	1
10078	Hey Navi! Whats going on with your damn Twitter account? Same issues eh? 2009 Time for a new start!	0
17866	Ahh.. Probably Cookies! D:	0
8344	how about loser buys the winner 2 months worth of diapers? hehehe	0
2764	To the question below  when you said: im not fat? Arent you suppose to say I&;m not fat  PERIOD? Cause if you put a question mark your saying your fat. DUMMY.	1
17222	Not at all. well i guess with timmy i am. he'll get me anything lol but not when I was a kid.	0
3781	Two nerds enter  one nerd leaves!	1
18639	To live....Pluto still. It'd be like living in alaska haha	0
10485	Damn that sounds so good I got fat just reading it  haha.	0
267	easy! keyshia sucks. It's pathetic when an actor makes a better album in his 3rd profession (act  stand up) than you do in your first	1
7672	ha! sucks for u!!	1
16113	Do you own a bathrobe?	0
7534	8 fucking am.	1
1500	i hate school =(	1
8481	i think so too.  xmas w my family has always been so fucking traumatic  it'll be nice to not deal w their crap!	0
4452	some retarded oracle peoplesoft login thing keeps coming up on my enrolment cart page and i don't know what the fuck is going on!	1
11666	Wanted to change my username -- 'v4sudh4' sucks. At least  'qbarq' sounds  better than 'meow' or 'spherical cow'. :/	0
18362	yes and i dont remember.	0
15471	Would you rather own a luxury yacht or a private jet?	0
278	that's a shame  I hate having to unfollow someone! :-P	1
18760	Do you have any jewelery on?	0
1219	stop hating on the tube...its this damn censorship thats pissing me off more	1
10788	Make sure you update that OS. Luck bitch. T-Mo gets the gasface with their lack of a new BlackBerry	0
1297	damn -- http://tinyurl.com/7b7nze	1
4540	I always thought of him as Hermy  the wannabe dentist.	1
17854	What song did you last sing out loud?	0
5821	call me emo again and i'll cut myself	1
11337	...fucking coded shit. I don&#8217;t watch old TV shows so I've only see the new Dr. Who  the stuff since the reboot. Loving David...	0
3744	cuz montana sucks?	1
19524	Do you like your living arrangement?	0
6643	Ummm...was that our little brother's ass? And you dare judge me?	1
10560	omg omg omg I am SO happy to see you on here! We're gonna have some fucking kickass fun. Fasten your seatbelt pussycat.	0
14063	Do you believe in luck?	0
3095	lol penelope died?? thats so depressive  i have a compaq it sucks  i dont have a name for my computer tho : )	1
4767	well  it is gay hippie stoner music	1
7787	Oh  heck! I was all ready to pull a Dan Rather and pronounce Dick Cheney dead.	0
4660	sure  I could use a lil snow here. The people would freak out here. LOL	1
1490	it's emo because you used a razor. An explained joke isn't funny. :(	1
15516	What&;s your number?	0
3129	re:fuck the creative industries blog post (at squares of wheat):I say:Waaaay too much empty rhetoric there. Be the Change ?	1
11661	Old fat finger type suing when I ment using	0
4333	alright. The test is on Monday and I'm gonna be studying my ass off.	1
6525	I thought the same thing  he should have just hauled ass.	1
17942	how many people can you tell EVERYTHING TO?	0
9454	today what I need is a 40 ft mecha with laser canons and missile arrays following me around London bellowing DON'T BE EMO  ta	0
15572	lmao thanks for saying im pretty  come talk to me? :)	0
1394	People are so fucking pathetic.  CHILDREN! Ughh~	1
9897	damn there is someones nana up here at beach with one. dont think ic an steal and get to you quickly tho ;(	0
17872	too much sometimes.	0
3046	Fuck. Well  you can for a low cost of 19.99 with shipping and handling. But that's only if you really want to.	1
2784	jerrrk.	1
16197	What is it you like best about your mateu2019s personality. What do you like the least?	0
19036	Thats for Taelin to know .	0
9036	Is someone a bit of a twitter control freak?	0
2496	ha! my ass be bowling lol	1
10030	I see you homie....Life's A Bitch 09': http://sharebee.com/c0756ec0	0
3759	the cock is just a figure head on favrd	1
4634	"We've maybe had 1"" total here across 3-4 different ""snows"" My first time with snow tires ever and I can't have any damn fun!"	1
5483	Hi new friend! I like your personality.super cool:) Yeah I forgot it is like 9 am there..that sucks!	1
13040	u better shut the fuck up wit that lol	0
17940	i like them all lol	0
930	yo I will nerd out on this shit all day!	1
5528	I had a dream involving a rhino chasing me because of my polo cologne. Everyone says it represents a fat woman. My life sucks.	1
8519	and fuck you I am a miracle :D	0
8496	and I hate you hahaha	0
2540	I see (:	1
12689	Townhouse is four years old. No cable lines. No high speed internet via phone or cable. Sucks. Wireless internet via digis.	0
16119	hey everyone im gettin alot of complaints please inbox me and let me know if u dont wanna be on my spam list	0
7920	Alyssa Milano is off tha market!!!! DAMN!!!! LOL	0
5509	no i think you will hate it. Its a bunch of dirty work.	1
7112	what the? how the? damn it	1
2091	Scars on my face? Are you threatening me? I don't like liars  threats nor unexplained coincidences. Kindly fuck off!	1
1735	Damn iPhone made my Brad & Angelina pick blurry!  http://twitpic.com/rddb	1
2229	I hate those fucking hash tags.	1
15439	Cleveland	0
1150	yuck... that is going to take a long ass time...	1
17364	What&;s your secret?	0
4625	Yeah! This blond gay guy came to audition. I almost fell out of my chair when I saw him. He looked identical to chris corner!	1
19269	how long have you dated your boyfriend for and where did you meet?	0
9573	- oh yeah! Actually these were done with no calories  carbs or fat! Amazing eh? :-) -http://twitpic.com/v440	0
14289	paris hilton	0
7045	"Oh yeah. That would be a good one. I still think they could kick ass doing ""Got to Get You Into My Life."""	1
16851	What&;s one thing you hate the feeling of?	0
2271	hate you both!!	1
13374	@cassiemeltesen no wonder they call us the three fat ugly girls! haha	0
7114	you can take the girl out of the hood but you can't take the hood out of the girl. Detroit didn't make me a pussy that's forsure	1
5833	home now. Misses wont let me drink beer tonight cus I gotta do shit tomorow morning.Sucks.	1
2051	I'll love him in the biblical sense  just as soon as they chop his emo hair off.	1
5961	I hate ism's as much as the next guy but when the shoe fits...	1
8127	that sucks. It would have ben fun and you could have had pizza! If it makes you feel any better im stuck home with a tummy bug. Boo	0
4436	ohhhh like that... well then shit girl  u shud be pissed. AAAND... u needa tell the BF his own blood is using his ass!	1
7681	aww  that soo sucks D:	1
8160	Damn you should have accepted them and said your name was @stephbarnard	0
10876	next week? I'll be the biggest loser in the world until then. (what else is new)	0
12319	I hate all my clothes at the moment too. That is why I like shoes and scarves. They always look good.	0
247	If you stay home to twitter and have a martini on NYE does that make you a loser?  don't answer that...  I don't want to know	1
3077	anna just has to ruin the holidays for me  just like every year. Damn you anna!	1
8155	mhmm dick has been doin well  even so  the team overall makes a lot of little mistakes they need to fix. we'd be a whole new team	0
10328	But i agree that Walmart sucks :)	0
4843	can u be a lamb & add a *gay* category to ur awards so I can nominate myself & others	1
2283	i hate you.	1
11179	dontcha just hate that stuff when it happens?! It makes me feel so dumb.	0
1030	Reminds me of this Turkish guy I went to school with. A-hole. Everyone thought it was cultural. It wasn't. He was just a dick.	1
12816	I like programming...but i hate theoratical sujects...like computer architecture	0
8436	thanks  I'm terrified of exams. Yeah my hairs a bitch to do tbh  takes like an hour and a half to straighten.	0
12717	erk. U poor sod. Is Rod Serling nearby smoking a fag?	0
3519	Oh  conservation you mean! That is a good point.  I admire many socialists but hate their ideals socialism brings with it.	1
4678	..........I hate SUVs. They're a great big ugly road hazard as far as I'm concerned. And very few people really NEED them.	1
2810	No honestly your really immature :)	1
5121	god damn you.	1
7390	Go back to your pork fat radio!	1
18855	Can you tie your shoes more than one way?	0
2723	YHUUU READY TO GET YHUR A$$ BEat THIS SATuRDAYY?!?!?!?!?!??!?!?!?!?!?!!?!??!?!?!?!?!?!!?!?!?!?!?!??!?!?!!!??!?!????!?!?!?!?!?!!??!!??!!??!?!?!!?!??!?!?!?!?!?!???!?!?!?!??!?!?!?	1
7684	emo!lol j/k	1
16436	What is one item that you really should throw away  but probably never will?	0
1574	and somehow I still wish I was there  pig parts and all. Amazing.	1
13576	Geek. Only because nerd is to harsh.	0
7218	that sucks  I know he was looking forward to that hook up...	1
15620	Idk  I don't really look forward to the weekend. Just means there's another week coming ahead.	0
5362	Tell her she says Bitch like it's a bad thing	1
897	att is run by the devil  i hate them	1
109	Ugh! I hate when I get spam followers... They shouldn't count against our talley of actual followers... :-p	1
9996	ass  I wanted that burger but my better judgement took control of the situation	0
9995	Oh Jen  I'm so sorry. That really  really sucks. Try some disposable cameras for Disney.	0
2881	"you should have her talk to @junsten about that. Similarly  he once told me  completely out of the blue  ""I'd hate to be a bird."""	1
4339	and holy crap  that's a long time!! D: that sucks!	1
19501	How many keys are on your keychain?	0
938	Fuck a serato record  I was worried about my windows crackin..lol..I can live w/o a serato record  I don't have a backup window.	1
11000	damn  that hurts.  I agree w/ @Wolfnoma more scotch will cure all that ails you	0
10374	yeah. It's ugly! And their rebounding sucks!	0
16461	If you were stranded on a desert island  which one person would you bring with you?	0
12593	Seen a news article on why the SLUT wasn't running? The surface rail/trolleys I've seen on the east coast wouldn't have blinked.	0
16892	Would you ever travel out of state to see a band that you like?	0
3990	aww damn now u know how much your Christmas present was *sobs*	1
6075	I'm keeping it now *just* to piss you off. hehehe	1
3194	I'm kinda meh on it--It wouldn't even be a contest as Madonna would kick his ass while he was running around screaming.	1
17781	Nope. I don't eat much meat actually but I don't think I need to label myself to eat what I want when I want it. lol. I lovee me some veggies <3	0
4183	damn! you packin heat!	1
3498	meeting friend for lunch/coffee. Getting hair cut (although I hate that bit) and my works do in the evening!	1
12002	I've put in planning for Monmouth Beach but the environment minister  Andrew VanWyngarden from MGMT  is a bit of a hard ass.	0
4897	fuck you  man. you can pick on garden state  but leave pushing daisies alone.	1
4048	that's why I throw a hard ice grill at him...no words...get the ticket and get the fuck out cause I've never had luck	1
15461	When was the last time you went to the beach?r	0
1194	haha  that's ghey. Tell them it sucks balls and they need a real designer.	1
17845	I miss you too !(:	0
6308	I will cut you in the mouth bitch!	1
13276	yea tell all your crackhead faggot whore friends. I am charging for entertainment	0
9241	@selcom60 Well  he is sick  but that's no excuse to be an ass at Christmas.  I'm gonna get me a glass of wine and chill out.	0
4053	I meant ready 2 fuck:) lol Hope u have something wild and freaky in mind. I'm bored :)	1
6388	Well good god damn.	1
10641	Most soy yogurt tastes like ass. But Whole Soy & Co is *delicious* - even my cats love it: http://veganom.com/	0
9600	although it means early holiday and time to prepare for next year - it sucks either way though	0
5248	i would hate that too. :(	1
16944	causes they can't have violence in the kids show. come on you knew that..hahah	0
10927	oh no  that sucks no computer	0
16209	Who do you lyk?	0
5394	and there were only 5 of us.. it was a night that i've already forgotten... damn the alcohol	1
4652	"dropped off some old 3.5"" floppies. A System Disk and Mac Paint.  Retro Mac crap kicks ass! - Photo: http://bkite.com/02RHw"	1
19260	no  im tabitha jai locascio. myspace.com/tabiisaninja i have a face book to  ask for it. I HAVE NO CLUE WHO THIS CHEYENNE IS  so please send a link so i can see for myself  because i guess she might be using my pictures.	0
3586	fuck right	1
5870	there only a few shows i really look forward to seeing.  i hate when they put a reality show on instead with no warning.	1
15043	Have you ever been to Hollywood  CA?	0
6266	And you didn't even make it a dick joke? I feel like I don't know you.	1
17143	If Uranus had earthquakes would they be called Uranusquakes	0
