	content	label
10416	Well  it's @ElysiumGWJ 's turn. Noone takes @Certis seriously  and @Demiurge and @GWJRabbit get the hate mail all the time.	0
390	fuck u and ur early screenings...jealous...prepare for tuesday mash...im coming with woody to freebirds/mash	1
1096	motherfucker stop drinking Red Bull ADDICT! watch ulcers eat at your stomach lining bitch!	1
1016	oh...and I wasn't just calling you a poser either :) http://is.gd/ed5v	1
2899	that sucks... so are there plans to get back together? or are they done?	1
15680	Then talk to him lol	0
2413	na just a bitch of a teacher!!!!	1
12773	aw man that sucks!! was it your brother again? =( im sorry	0
6112	OMFG. I JUST FIGURED OUT THAT @SHIT. AND MY FIRM'S IT GUY TRIED TO GET ME INTO CHUCK. IT'S REALLY NERD-O.	1
4224	"my lungs are fine  but my legs are like ""bitch  your ass is heavy !! let's stop !""."	1
14729	There is no perfect lol but I suppose with a funny guy-polite  random and spontaneous  maybe a night out at a 70's club and dress up go to dinner before. haha that'd be fun!! :)	0
3394	depends on your plan. if you pay out the ass for it  no.	1
2225	Just keep your head up...you kick so much ass...	1
124	They say I have the best ass this side of fourteenth street.	1
12034	that's my dad's reasoning. i just hate the shit out of kobe bryant though. i think i'm rooting lakers though.	0
8302	I hate that	0
13549	damn nature  you scary!	0
17630	Timothy. Because he would prolly be following behind the cop car waiting in the waiting room for me already.	0
12126	Good night  sugar. It will get better! I'm always here if you want to piss and moan (or cry and whine). XO	0
6460	If you guys are having the problem that pages aren't fucking loading  then I'm having the same problems too.	1
8594	The #9  This fucking blows... good thing I've had a good book to read. And I'm supposed to make an appt at 3pm?	0
7539	And I HATE gangsters &gt;.&gt;	1
9364	"no but Dana Dane's washed-up ass came to the park once to do ""Nightmares"" womp  womp"	0
3896	haha nah he didn't do anything I was talking about guys in general particularly a guy friend though and he was being a dick to  ...	1
5775	and @rapperbigpooh. Was that Sheila easton? Nah...it was that chick that used to fuck with Prince right?	1
3150	hola! Orli ... we are www.LuckyStartups.com looking to interview some kick ass peeps in Israel... you up to it?	1
651	I hate you with the hate of a thousand hates. ;)	1
18677	what&;s yer bra sizee haha?	0
13955	my weak camera I hate it. I want one of the High-Tech cams. Like the one meldcole uses. His pictures always come out on point	0
1072	"Because ""Oh  for fuck's sake!"" has so much more impact. And our generation likes to offend old people as deeply as possible."	1
8971	"fuck me! I'm checking tomorrow."""	0
468	damn bossman  let find out u got 2 jobs. what are u  a single parent or somethin'?	1
1788	And by no one I assume you are including me...damn.	1
8651	haha  damn...all it took was a pick up line?...SCORE!	0
7537	That sucks!	1
14053	still a student??	0
11986	That sounds like a plan. :) Kick ass  indeed. And any beat that stands the test of time is a banger  for true.	0
10651	oh damn... lol then ill send them when you have a comp or something lol. do you have verizon or no?	0
13675	lol I know... very well mannered... aren't I? But it's TRUE!! I hate that we have to choose such a small number... not fair.	0
1371	How the hell do we get in these money situations? Sometimes I just feel like saying fuck it and have them come for my car.	1
7550	You fucking rock =)	1
11866	yo peezy... celeb status already??? I mean damn.. it hasnt even been a WEEK YET!!! Eh..I dont mind and Im sure you dont mind :D	0
3382	oh man that sucks. I'm sorry. Sucks to live with people who are dirty..trust me  I can relate.	1
12174	Thanks so much re: the video. It was a pain in the ass to make  but I'm glad I did. :)	0
17446	he has actually. and i thought if we were ggoing to keep conversating you would reveal your anonymousness. you know you asked buncha ppl bout their feet..lol	0
8387	I haven't seen the fail whale in a month or more. Saw it today!	0
299	http://twitpic.com/xipq - this only makes me hate having a verizon contract even more.  erg.	1
1009	the cock is just a figure head on favrd	1
2688	Oh bitch you can&;t hide cus I&;m gonna find you and we gon have a problem hoe	1
3724	No can do  Maria. I'm going out alone. Don't stress about your shitty wombat friend. He sounds like a loser. Get some sleep.	1
12069	"asses and it's like the whole world is like  ""OMG  I HAVE NEVER SEEN AN ASS LIKE THAT EVER IN LIFE!""  wut?!?!!  Outrage! lol"	0
14139	Do you believe in fate?	0
3554	I meant boo YOU whore!	1
14324	yu tld me lmfao lykk yestadayy	0
11438	*gasps* he hasnt done it so there for he is not a whore.	0
14565	Do you think you could defend yourself if need be?	0
6144	I nominate @jcroft for a Shorty Award in #down-ass-bitches because she totally is one.	1
15724	i miss you too  &amp;&amp; i cant believe ur going to north!!	0
6297	FAT WHALE U still Floating  Did not SINK Yet?	1
12271	spproductions people kept tellin me get this shit...I'm like 4 real? ok...I'm goin tell yo ass everything! lol	0
16207	oh yeahhh we already talked about this. :)	0
19523	hahahahaha http://lmgtfy.com/?q=What+is+a+dero%3F	0
4408	Damn. Oh well  I can't raise my hand for every question. ;-)	1
11617	what is that?  and yes  it's damn cold  about 5 degrees in Mpls.  At least you're in Texas  stop complaining my friend!	0
368	Funny I always thought Job Security is dependent to how much ass you can kiss? (wait I guess they are one of the same if you think..)	1
14808	i dont believe so. only that i would help more than i do now.	0
19480	im bout 5'9	0
4531	i hope singing along- i'd hate to think i'm torturing poor little Pixel!	1
1401	!!!!!!!!!!! FUCK YEAH YOU DID. &lt;3 &lt;3 &lt;3	1
12999	we gotta fucks w/ that... fuck a coach bag  sheeit looks hella generic  not impressed	0
664	pussy!? :)	1
9504	Oh yes  we have a little snow as well. I love the snow but hate feeling cold.	0
18144	That&;s okay; I have Aidan(:	0
16330	i like to talk  yes.	0
1529	P33T WIFF HIS BIG GAY TEEFS!!! BRYCE FROM TRS AND HIM SHOULD HAVE BABIES AND THEY'D HAVE AMASING TEEFS	1
6731	lol no no.. we will kick the pig... (kick this thing off  do it  get r' done  etc.)	1
7408	way to not text me back DICK. :P	1
6346	LOL well it's funny as hell they got two fat asses trying to fit threw some small holes.	1
6370	"Why would gay marriage ""change the basic structures"" of your family life? It neither picks your pocket  not breaks your leg"	1
61	Ugh  twitter stop it  you fucking slut.	1
16631	hi!how are you?thanks for spamming	0
18662	Who were the last people you ate with?	0
646	We loovveee chicken.  Damn i do also so I really shouldn't complain.  And since I found the chicken i am in a better mood.	1
2735	not telling. you will have to just find out on your own. it probably won&;t be too hard though.	1
18228	haha yup i know thanks! :D	0
14436	so are you talking to shira or frances? its hard to keep up  playa playaa lol.	0
5888	"It was not fun	1
I hate you	1
im not sure if i should taunt you with how awesome it is  or say im surprised it took this long to get snow hate twitters	1
omg i would shop my ass off but that's because i have like zero long term goals :(	1
Better than that shit ass falafel box you eat once a week  I'm sure	1
thank you  she's such a big baby. lol But such an incredible dog. hate to think of life without her pain in the butt self	1
it really depends on the situation but when I get mad I just call old girl up and get the freak on	1
Take Ur ass home	1
HAHA...emo lawn.  I dig that!	1
lol...i disagree...Dick in a Box got too built up for me. It's funnier now...but it wasn't when I saw it. :-( jiz in my pants rocks!	1
on dude......a whale remember	1
i am doing no such thing fuck you	1
You didn't imagine it. It was the get away from her you bitch"" climax scene being parodied."	1
3801	don't fuck with Fiat	1
1968	So you are right... reciprocity is a bitch (Just not in the way that Lauren Hill meant it)	1
7797	OMG. GREAT list! I can add to TMI Freak. Folo one who shares stories about sex toys. No joke.	0
5721	well either wy thy like dick wayyy to much.	1
9842	ooh mate - that's very generalistic  like saying all journo's piss you off. what is the cause? how can SocMed people help	0
11251	damn...bird flu acting up again?	0
11995	Oh sweet! Sucks though that you work New Year's: my condolences.	0
16806	THE LAST MESSAGE WAS JUST FOR PEOPLE WHO ARE BEING RUDE IF YOUR NOT DISREGARD!!! :)) SORRY IF I OFFENDED ANY OF YOU!!!	0
15897	Do you like Kool-Aid?	0
12795	Awww  but I'm a nerd. (Does that help any? :) )	0
297	attention whore!	1
6639	I know - I really wanted to go to the show - but I gotta be responsible. I was in class w/all the idiots. I hate them all!	1
4981	A pussy on my cock on my pussy  if you wanna take it further. ;)	1
5837	depends on your plan. if you pay out the ass for it  no.	1
15808	hello i would just like to tell you that i think your soo perfect  and adorable  a LIAR and totally kissable&;&;and im pretty into you<3 do i have a chance? [;	0
5203	fuck you haha	1
15495	Chocolate or vanilla?	0
6006	2008 is over? Damn  what'd I miss! I quit keeping track of years after 'Buffy' went of the air...	1
14311	jansport :)	0
18454	Would you rather own a luxury yacht or a private jet?	0
19577	Sometimes if your daydreaming but then your daydreaming so its not nothing..haha	0
1079	I wanna butt fuck you. Cuz im a horny gremlin	1
3207	summer workout tape? How you gonna workout to Kanyes depressing ass album  ok  maybe 2 songs	1
2423	you're a nerd fail	1
16601	the dryer eats them.	0
6753	like  you build a tolerance to drugs  don't you? or is this just me being dumb cause it's fucking four a.m.	1
4301	bojangles? damn you! so jealous.	1
8575	have you seen it before? We had a great time. Being a Python nerd help  of course.	0
3266	you fart like a fucking bass drum lol	1
13175	all the effing snow is in fucking washington!	0
5584	GOOD! Now u can bring ur happy lil' ass over here & help me finish hanging this garland.  ;-)	1
19486	If you saw your zipper was down and people had noticed  what would you do?	0
9817	I know. It sucks. I've had to get a lot of people out of my life. It's sad.	0
10579	ouch that sucks.. Sorry I wouldn't even know of one in Cleveland.  I will stick with guitars.	0
17100	i found you on jensens thingie. i cant really see your picture but i guess your cute?	0
19589	hahahahahaha yess. :)	0
14018	hahahahahahaah thanks spency :DDDDD <3 you	0
731	- Oh  yikes!  I hate that.  Will she willingly use the toilet for it?  My boys won't.	1
12662	there is a man who walks his p-b-pig in the domain wonder if they are related	0
11550	don't have time to review the whole thing right now  but here - fucking - here.  I'll take contributions to the bottom line tks	0
1747	yeah  most people just think i'm a bitch cuz i got that screwy sarcastic sense of humor that tends to tick people off? my username?	1
3863	oh word? Back to the old photo? You green ass backdrop mother fucker!	1
6788	so fucking angry all the time	1
3919	how did you meet dad BITCH!	1
6728	damn that caller ID	1
10410	that gem fucking with santogold and kanye west is fucking sick! love it.	0
18956	why do u have a new &quot;girlfriend&quot; like every single month??	0
16342	What amazes you the most?	0
5029	Fat Boys have a new song?!	1
9767	april to may is humpback whale season in new england. We bringing hump back? No? I tried...	0
1522	or maybe go see bolt tonight? or both? don't know if you're busy for white whale stuff... but it's my bday. let's celebrate	1
4017	If you guys are having the problem that pages aren't fucking loading  then I'm having the same problems too.	1
6853	damn I'm behind	1
10861	haha. that sucks though. if it's any comfort  i had a student break some of my XLR contact mics. gotta break out the iron now.	0
17880	PURPLE. not lavendar. Eukkkk. Deep dark sensational violet :)	0
17026	not too often.	0
172	dude dont tell me what to do thats not your place. i do what i want. just chill the fuck out and worry about yourself.	1
8945	Therefore  I hate you. Lol.	0
12263	"dude Stef says ""he is the biggest pussy on Christmas eve ever"""	0
478	omg son i JUST figured out how to reply to youuuuuuu. i hate this lmao	1
13038	More like piss and vinegar. You could call it cancerous ale.	0
17583	Where did you learn how to drive? I learned in the freeway lol i was paranoid as fuck!!!	0
9674	I hate ants.. I hope you get them...	0
3093	Damn skippy. I should be dead 10 times over......	1
301	AWWWW I HATE THAT!!!! I had to buy that gadget you can stick your hard drive into to pull them off. SO SUCKS! Sorry. :0(	1
5123	aw that sucks.	1
1841	dude no offence you're awesome but currently I think I hate you. :0)	1
13541	You gonna change your mind now and come to CES..if so give me a tweet kick ur ass in someww pinball.	0
4852	yes yes  so gay.	1
18567	GUYS- What do you hate most about girls?  GIRLS- What do you hate most about guys?	0
10437	im jealous lol.  u better protect the penis at all times i dont care how cute YOU thought she was lol Hate hate hate	0
14291	Nicoooo! :) okay...welllllll bye :)	0
4419	yeah and I woulda gotten away with it if it wasnt for you damn kids...	1
14572	Idk cause it has a great beat. Jim cracks corn and i dont care  jimmy cracks corn and i dont care... hahaha	0
13199	Been trying to find Run Run Rudolph..smart ass! (we're staring with it next Saturday)..Same versi... &#9835; http://blip.fm/~14szw	0
19626	i dont do brands. i do the look. i like how it looks i buy it.	0
6517	makes sense and glad that it's shifting (even if geologic).  hate that kind of snobbery.	1
6240	fuck you dom	1
16206	Your beautiful<3 don&;t listen to others(:  they don&;t have a beautiful thing called LOVE<3 while you do  cause we are married :p  I love you<3	0
5298	"where'd ya put it? o btw: ""kick ass quote Copyright&#169; 2009 @abcd91 All Rights Reserved"""	1
9063	that sucks. i sent you what i think is a decent tag lastnight and will likely send one today for Lachlan. feel better.	0
17956	Urgh no1 yet! Keep hopin though!	0
10390	imma be as nice as possible alrite. talisa how the fuck do I kno? do I watch da disney channel' ? uhh. . noo nigga lol	0
9836	nooooooooooooooo damn damn noooooo its not like that! eeeeee why meee	0
5911	WOOT!! 8 pounds is AWESOME! YES  you can! 1 pound at a time... I need to get my ass in gear ;)	1
196	Prison Bitch is a sparkling addition to any resume.	1
9433	no I dont they my peps/frens and they super...fucking comic book fiends reading to much like its they project smh lol	0
7316	That was fucking hilarious... WIN	1
15416	Who is thiss fer real??	0
15317	I hope all of you have a good day. I need to go clean house. My stepdad is coming here from Arkansas with his fiance. (My mom and him divorced 3 yrs back) And they are going to stay a few days. So to everyone  I hope you have a great day. And I will quest	0
818	Called in gay? LMAO!	1
11067	ur invading my space! @prezzure kick his ass out starbucks	0
12024	I DO UNDERSTAND! I WAS TRYING TO PISS YOU OFF! AND IT WORKED!	0
13385	I hope not there is no bathroom where I am parked... O' Damn....LOL	0
9739	Brutal...I hate when you pick the wrong day to drive....	0
18716	mountains or beach?	0
3546	I cunt wait for u to start shitting out the gifts I sent jew.	1
7206	that sucks for your teacher. poor guy. isn't your class full of adults? do they act mature like adults are supposed to?	1
10010	i hate you right now you woke me u last night and then i had a crappy sleep  i feel like shit now.	0
3162	Merry Christmas to you too  Casey. For tomorrow. Er  or today. Grrr  damn time zones....	1
4285	damn that caller ID	1
9921	Haha  that's a long-ass tail!	0
7117	bitch better share this vivid alt shit isnt doing anything for my vagina and its moistness. fuck.... EON I WANT TOSEECOPULATION	1
7690	to get fat?	1
4809	Y'know  it's very stereotyped emo.. I know plenty of older people who follow the trend / cult the whole way.	1
8744	geez what crawled up ur ass my man im just messing with u...take a joke...	0
19201	! W@N+ YUh 2 T3@R M@ PU$$$Y UHP	0
6957	guess who made a fucking surprise in my dreams last night you butthead!!! thanks to you Martha Stewert loves my dreams! baaah	1
14897	Who&;s the funniest person you know?	0
8194	I AM NOT!! I cant believe you said that &gt;.&gt; Hate you so much right now	0
10829	Nope  Pho Pasteur  tho I just heard that they upped their price. Xe Lua sucks.	0
6235	who the fuck is bur`li?	1
2937	yes i love the pillows  livejournal jrock rotations (get an lj  they're sick) and uhh fuck i dunno  twitter?? just the site	1
12132	Well HOT DAMN. Look at you  catching up with the social networking. Next you're gonna tell me you have a Kaboodle!	0
6754	Haha. Cool. Just sucks that we have to wait so long for season 2.	1
15826	Do you like the smell of cigarettes?	0
16750	Ballfuck  she&;s real. Get over it. vv	0
7336	Oh damn. Saw the trailer for Dark City&#8230; Looks gooood&#8230;	1
16537	Would you ever try to summon the undead?	0
13676	Damn right.	0
10769	So do so. Though I recommend opting out gradually over several years - relatives freak out less then.	0
9568	OMG! haha I would not survive  I hate the cold.	0
15629	whuut youu up 2to ? follow me on dis shxt :)	0
17202	What happens to an irrisitable force when it hits an immovable object?	0
17410	Which is your favorite day of the week? why?	0
5930	hahahahahahjdshgskdg I hate you. So much.	1
15120	Do you prefer to be blissfully unaware? Or know what going on though it may hurt to know?	0
11877	Joe the Plumber: scofflaw  activist  or just another cheap-ass?	0
11856	Yup  gypsy bitch is one of my faves from devil doll	0
7846	damn skippy trippy :)	0
18819	big booty whore.!!<3 omg i miss you soooo much): dontt go to north.!!):	0
16677	If you could hear what someone is thinking for a day  who would you choose?	0
8776	I was glad anyway. Bitch was was blocking my hustle. Now hoes sit back seat. MOB and that no bullshit till the grave	0
13410	your code sucks! ;D	0
9853	BRB SLITTING MY WRISTS JESUS FUCKING CHRIST.	0
6295	whats wrong with a monkey fuck? Lol i got my zippo fueled so no need of monkey fucks now lol	1
7495	Gypsy bitch!!!!!	1
2116	don't worry  karma is a one mean ass bitch. They'll get what's coming to them...	1
8976	Newsy v 1.0 wouldn't have given two squirts of piss about work. Just sayin.	0
3595	Big Ass was this past weekend and went well  #2 (Last Minute Maul) is this weekend.	1
6839	that really sucks!	1
1634	Damn near indeed! But in the end  their youthful impetuosity gave it away. It didn't feel like SL actually won it  incredibly!	1
9666	Only too fucking true.	0
15856	http://formspringme.zendesk.com/home complain about FS and the limitations they&;re making here  you have to make a whole new separate account to do it.	0
5712	damn bossman  let find out u got 2 jobs. what are u  a single parent or somethin'?	1
18681	does your bedroom door have a lock on it?	0
7012	& @karkar  I hate Walmart anymore. I'm gonna have to start taking my own cart with spikes and barbed wire. Maybe flamethrowers.	1
17194	live life love	0
17134	hahaha im pretty sure he has a girlfriend  and even if he didnt there are sooo many pretty girls than me.	0
120	Already on the coffee. I love her  but hate the whole spite thing. Climbed right on top of me to do it!	1
2027	i hate her in every movie. she has one look. you know the look haha	1
19611	MOst dEfinAntly. <3	0
8482	hahaha! I hate driving alone... but sometimes carpool is the slow lane	0
4174	I get your tweets on my phone and my ass was just vibrating like crazy lmao	1
2972	gee  i'd hate to see what you say about the family ;)	1
17188	haha!! it is haha lol!! man i hvnt even gotten 2 dat part yet! FML hah	0
7588	hahah  ass :P hehe	1
11102	hugs hugs hugs you are good we are very happy with you and love you and don't hate you.	0
3012	have a safe flight.....damn now you make me want some jamba juice	1
4772	"*sigh* oh  Karrine. You said the phrase ""Sluts with Butts"" on a site called MomLogic.com. You fuck'n rule! :) LMAO"	1
8734	Wow  that sucks. )c8 My condolences on your loss. I hope the HD springs back to life long enough to get the data back cheaply.	0
7499	enak aja! nick carter ga gay!!	1
2281	Heores Season 2 sucked! Full of emo shit!	1
10642	Heading to get the pig soon.	0
2003	xD! i know. hmm ....i wonder how it feels like to fuck bingo  hard .....hmmmm  i guss i'll never know D':	1
16970	stalker?	0
15553	hehe oh i see (:	0
4601	grrr I hate that. I have an ex-friend who only gets in touch when they have something great to tell me about themselves... o_0	1
4811	: Dude  you're gonna hate me! Here... more T-shirts for da T-shirt lovers : - http://snurl.com/8fhdw  : )	1
13422	I might be able to pull off the Ass-Miss spirit but not in the Christmas spirit!! LOL	0
1996	Whoa. Marc Blucas' new hair is a fucking crime against humanity. The horror. From loveable goof to douchebag  instantly.	1
9344	HELL NAH!!!! Not the ass hole?!?! LMFAO!!!!!	0
16629	If you could attend any concert  what would it be?	0
8606	did u piss off big bird?	0
6978	I saw that. what's his name! In so far as the fat bastard - what?!	1
8051	well i have other people following me outside of blogtv kiddies. i don't want to piss them off :-(	0
10419	Um...sorry  Yatty. HATE shopping this time of year. Do everything online. Good luck  though!	0
2506	On a 1 to 10 how mad would you be at me if I were to rape you?	1
13729	nope  it's spent already unfortunately. Fuck christmas. lol.	0
6684	It sucks!!! My kitty (adopted alley cat) only knows how to potty outside  so I was freezing my arse off trying to get it in. LOL	1
18977	Uhm. Fun  Funny  Athletic  Outgoing  Creative  And awesome! (: Duhh lol	0
2013	that sucks for your teacher. poor guy. isn't your class full of adults? do they act mature like adults are supposed to?	1
8614	And so it begins. Ugh. I hate winter.	0
18308	you felt like you could fly :D	0
2611	Did you know you smell like an old man?	1
17937	Have you ever been ashamed to use your cellphone in public because it was so outdated?	0
6407	I remember when being snippy just meant I was trying to piss someone off... am I showing my age? :)	1
3383	I felt the same way 3 weeks ago. And then proceeded to watch the whole. damn. thing. lol	1
16491	Are you a people person?	0
9638	-- but hopefully not the ass right?  :)	0
16032	pictures!	0
11381	first off you knew her ass was going to become one either way she was already engaged to e married so of course she sealed the deal	0
19161	If you could go to a planet  which would it be?	0
16507	I would buy my mum a house and a car buy me a house and car buy my brothers a car and with the left over money i would go shopping and concerts (i dont no how much all this cost though lol)	0
17165	Do you have any concerns at this moment?	0
12570	i hope not Tara! sucks someone would do that.	0
1091	What shall we call this gang? Initiation rights must begin with downing a Fail Whale.	1
1323	i still feel bad. I woke up at 2 am and was like fuck! Then i saw that carly called	1
3770	OMG! cute emo cow! that would be acceptable! and the cow wouldn't mind the blood drinking...	1
8762	"Damn  that's crazy...And from the pic it looks like he ""got grapes""....ahahahahahahaha..."	0
11452	agreed. Continues to piss me off too.	0
4465	omgomgomg those shoes with the little flower holy fuck i want them	1
19082	the changing my color. I love that :]	0
16527	My Dad :)	0
4147	psh bitch I'm at work running 2 trains with a 70 minute wait stupid kids and dumber parents I don't wanna hear it	1
9917	mmm nice. problem is - i hate reading blogs in hebrew. i can read them but it takes me longer and i have ADD	0
647	social network whore!	1
18050	Have you ever played a game that required the removal of clothing?:	0
11521	You know what's going to happen at 7:00pm central? An announcement will be made that OU still sucks. :-)  (PS I think UR right)	0
8201	Damn iPhone  I meant wine and cheese	0
8164	omg me too. for reals  it's getting outta control.  I wanna get off the pill man  i'm hungry all the fucking time! Lame!	0
6879	ohhhh like that... well then shit girl  u shud be pissed. AAAND... u needa tell the BF his own blood is using his ass!	1
7737	I hate it. Horrible stuff.	0
4441	oooh  I wish I could! but then I have to shave my widow's peak to get them to hang right. And what a bitch to grow back! LOL	1
8140	hahahahahah fuck  awesome :D +faved	0
16996	Nope. I don't want to be a doctor. Only a nurse. traveling nurse actually :]	0
18857	what do you think of guys who wear headbands/ponytails?	0
15129	Are you obsessed with shiny things?:	0
3131	I *really* hate housework! Then again  it was great waking up to a clean LR & kitchen! Maybe I should do it more often... :-)	1
9883	Back at ya bro! Thee Oh Sees are playing Thursday and I actually have some money now  lets fucking rage!	0
19693	Last gift you received?	0
13515	glad to hear you got comments and not just DM's. I love to hear people work it out  not bitch and hide ;)	0
17741	Why did you make a FS account?	0
4915	that does sound gay. I never had that in year 12. And thanks!	1
11548	yeah i just don't wanna do blackberry but they may wrestle me into it just because they r kind of the best. i hate 2 admit it.	0
3604	I'm sick of this bitch. He's wrecked enough of my life and I want him gone.	1
3056	Then she changed roles and she is a little less bitch from hell but still  her sting has too much barb.	1
13309	you get to buy booze  i get to drive with my parents in the car. FUCK YOU.	0
9677	true :) just informed no food til we find out if I'm going into labor soon. Laughed my ass off thinking on how unprepared we are.	0
9300	That sucks!  My son's myspace got hacked recently  it was awful!	0
8837	"Well ""That n*gga sucks"" and what? Lol Im kiddin :-)"	0
14387	Do you think we are raising the next generation right?	0
16220	That person VV isn&;t daydrien is it?!?!?	0
